userId,id,title,body
3,21,asperiores ea ipsam voluptatibus modi minima quia sint,"repellat aliquid praesentium dolorem quo
sed totam minus non itaque
nihil labore molestiae sunt dolor eveniet hic recusandae veniam
tempora et tenetur expedita sunt"
3,22,dolor sint quo a velit explicabo quia nam,"eos qui et ipsum ipsam suscipit aut
sed omnis non odio
expedita earum mollitia molestiae aut atque rem suscipit
nam impedit esse"
3,23,maxime id vitae nihil numquam,"veritatis unde neque eligendi
quae quod architecto quo neque vitae
est illo sit tempora doloremque fugit quod
et et vel beatae sequi ullam sed tenetur perspiciatis"
3,24,autem hic labore sunt dolores incidunt,"enim et ex nulla
omnis voluptas quia qui
voluptatem consequatur numquam aliquam sunt
totam recusandae id dignissimos aut sed asperiores deserunt"
3,25,rem alias distinctio quo quis,"ullam consequatur ut
omnis quis sit vel consequuntur
ipsa eligendi ipsum molestiae et omnis error nostrum
molestiae illo tempore quia et distinctio"
3,26,est et quae odit qui non,"similique esse doloribus nihil accusamus
omnis dolorem fuga consequuntur reprehenderit fugit recusandae temporibus
perspiciatis cum ut laudantium
omnis aut molestiae vel vero"
3,27,quasi id et eos tenetur aut quo autem,"eum sed dolores ipsam sint possimus debitis occaecati
debitis qui qui et
ut placeat enim earum aut odit facilis
consequatur suscipit necessitatibus rerum sed inventore temporibus consequatur"
3,28,delectus ullam et corporis nulla voluptas sequi,"non et quaerat ex quae ad maiores
maiores recusandae totam aut blanditiis mollitia quas illo
ut voluptatibus voluptatem
similique nostrum eum"
3,29,iusto eius quod necessitatibus culpa ea,"odit magnam ut saepe sed non qui
tempora atque nihil
accusamus illum doloribus illo dolor
eligendi repudiandae odit magni similique sed cum maiores"
3,30,a quo magni similique perferendis,"alias dolor cumque
impedit blanditiis non eveniet odio maxime
blanditiis amet eius quis tempora quia autem rem
a provident perspiciatis quia"
